homework_id,assign_date,due_date,description
1,2024-02-10,2024-12-09,Four hope one per fish need position can style major parent amount customer.
2,2024-04-16,2025-09-12,Five myself only all above say his eye table positive oil receive.
3,2024-08-02,2025-04-23,Peace point sure huge civil final game despite yes.
4,2023-11-26,2025-11-06,Paper spend set on identify determine make foot task new budget ground.
5,2024-06-27,2025-02-21,Myself audience also hold audience present fall north particular.
6,2024-06-24,2024-12-28,Guy save ball stuff instead home foreign public check.
7,2023-12-05,2025-05-26,Unit well star image today most production you good different public between music.
8,2024-08-23,2024-12-05,Physical skill set since dinner former wait chair of cost suddenly team guy station.
9,2024-01-07,2025-05-07,Name bad goal challenge no money important hold write.
10,2024-05-09,2025-01-22,Build large interview remain exist weight history cold hotel.
11,2024-01-13,2025-06-19,School point hot drive seem safe drug.
12,2023-12-11,2025-10-29,Yourself perform something or top beautiful company expect charge.
13,2024-04-23,2024-12-18,Raise stock this look foreign thousand.
14,2024-01-04,2025-05-17,Visit TV various along within effort four she source number expert perform west year.
15,2024-08-24,2025-02-26,Agent hotel expert enter eye still certain behavior really himself themselves season color prevent.
16,2024-05-21,2025-10-24,Thing than player treatment media improve dark list.
17,2024-02-05,2025-04-29,Red plant thing father indeed add challenge market ago.
18,2023-12-25,2025-08-27,Full can factor network pass into nature up kind choice agreement.
19,2024-01-07,2025-01-28,Direction again head hand international writer plan product return no pull president statement.
20,2023-12-01,2025-08-23,Save take development house worry sit nature certainly allow various glass dinner.
21,2024-04-08,2025-10-29,Century teacher hour car then watch mother president themselves.
22,2024-08-13,2025-02-04,Interest mouth experience do whatever message change sit international hope who.
23,2024-10-26,2025-01-27,Central expect seat special world debate.
24,2024-10-19,2025-09-08,Large very watch take read try manage day up former bill create.
25,2024-03-04,2025-06-08,Body method quite guess baby own city fish friend focus campaign.
26,2024-06-07,2025-10-08,Service condition their include fight recently government performance.
27,2023-11-09,2025-10-16,Defense better try send think forget value.
28,2024-02-23,2025-02-19,Course girl college check hope be result spring evidence benefit.
29,2024-09-05,2025-04-06,Few down including recent have show method process herself.
30,2024-04-13,2025-05-12,Economy visit wind player sport by whole point might anything bag executive best.
31,2024-11-03,2025-03-30,Shoulder woman whom citizen quality sit main environmental international shake.
32,2024-10-05,2025-04-02,Kitchen Congress way growth of growth road of maybe outside.
33,2023-12-15,2025-04-27,Ever create more anything job know seem those to require ask speech.
34,2024-03-09,2025-09-20,Heart anyone man issue public increase because they.
35,2024-07-14,2024-12-27,Film skin ball across possible former.
36,2024-11-04,2025-10-27,Project seem attack win customer next movement summer onto everyone gas clear.
37,2024-04-21,2025-02-01,Under sound consumer TV experience positive.
38,2023-11-23,2024-12-30,Effect analysis everything avoid peace yet air spring finish.
39,2024-08-18,2025-04-04,Concern here include article maintain short PM not.
40,2024-06-07,2025-06-01,Grow everyone much peace throughout behind modern debate many experience security past western.
41,2024-05-09,2025-09-08,Share inside go operation cell production dinner.
42,2024-11-03,2025-10-07,Really research system security it like thought nation word under.
43,2024-05-17,2025-03-15,Everything beat first design sit turn.
44,2024-10-08,2024-12-20,Believe drug door soldier whose physical soldier traditional million cover little.
45,2024-02-27,2025-02-12,Decade staff dark over today concern traditional natural law international.
46,2024-01-11,2025-03-30,Democratic American leave development at discover practice team perform again energy.
47,2024-07-11,2025-03-09,Than every stock degree evidence fast perform hear too.
48,2024-04-08,2025-04-08,Positive half apply data commercial card tree member film possible would serve morning.
49,2024-09-26,2025-04-28,Picture finish especially start little catch another theory happy behind strong.
50,2024-02-11,2025-01-04,Better sport painting end artist treatment create not.
51,2024-01-05,2025-03-07,Dark exactly anyone road administration rest around build life every treatment relationship.
52,2024-04-15,2025-08-07,Environmental three million each news good.
53,2024-02-19,2024-12-14,Structure drug could some institution manage check continue show reality which baby look.
54,2024-01-31,2025-03-23,Role western house season move so less certainly.
55,2024-01-25,2025-10-25,Room ten visit left measure grow now.
56,2024-06-02,2024-11-22,Cell toward change at together sea Mrs that.
57,2024-02-29,2025-10-25,Summer threat woman bar end cut site turn plan into total front likely.
58,2024-05-13,2025-05-04,Design voice another night right resource ten camera assume south others computer close.
59,2024-05-09,2025-07-19,Hit card wish ready hit provide large item leave.
60,2023-12-05,2024-11-24,Easy fight bill all develop fill stuff body white.
61,2024-06-23,2025-05-04,Again car all actually form information only up mouth citizen contain artist.
62,2024-09-04,2025-05-07,Television art quality guy behavior my assume environmental answer return actually marriage.
63,2024-01-16,2025-03-20,As media deep program also goal fall against itself put.
64,2024-01-04,2025-07-05,Thus help before positive soldier town table never bad around ten rich.
65,2024-04-26,2024-12-26,Firm three source contain south herself cultural.
66,2024-06-24,2025-10-31,Response instead physical contain already world another exist order sit glass.
67,2024-04-26,2024-12-29,My deep cost then public group smile avoid pay pressure.
68,2024-10-15,2025-06-28,Course best individual rise both treat form nearly view.
69,2024-03-11,2025-05-23,Without also important mouth course item.
70,2024-01-25,2024-12-14,Side technology recent ability interview year behind summer fine story away turn turn.
71,2024-03-24,2025-03-05,Drug agency pay parent produce somebody call decade near degree.
72,2024-04-26,2025-10-04,Party option each her here similar anything.
73,2023-12-14,2025-07-17,Outside city most meet arm main realize information audience fly.
74,2024-02-26,2025-01-23,Collection information me among clearly through majority war window.
75,2024-02-10,2025-01-03,Tax chair smile direction size to first whole public.
76,2023-12-12,2025-02-13,Leg mean start concern true difficult fast happy rate up position reflect idea.
77,2024-04-03,2025-03-25,Road method official step drop even.
78,2024-05-10,2025-10-21,Medical opportunity parent gun seem support computer cause hour south create.
79,2024-07-19,2024-11-17,Remain everybody century station continue floor.
80,2024-07-10,2025-03-10,Leave enter authority everybody produce government worker people someone police next decide reach.
81,2024-08-17,2025-06-12,Poor allow join then ball response project surface.
82,2024-06-13,2025-05-17,Strong suddenly nature sit player design still piece.
83,2024-06-04,2025-04-28,Rock full size huge produce commercial interesting consider suddenly only interview.
84,2023-11-09,2024-11-20,Public teach responsibility chance ball what argue shake view expert way act thing.
85,2024-07-17,2025-06-17,Name rest however him cup less themselves you since must bank law edge.
86,2024-10-21,2025-02-22,Because hit one region sound organization recently its right material miss indicate.
87,2024-02-15,2025-06-30,Others data as question week group question cup fast which middle occur.
88,2024-04-03,2024-12-21,Test require edge owner organization outside Mr maintain table situation.
89,2024-02-02,2025-02-28,Writer up give operation base west.
90,2024-06-03,2025-01-25,Difference sort pattern short though economy.
91,2024-09-21,2025-07-23,Government past card task case one admit hear.
92,2024-03-26,2024-12-17,Yeah site size baby build authority lot look born.
93,2024-08-30,2025-08-29,Something by place expert night stop stay poor during impact more individual ten artist.
94,2024-01-07,2025-06-30,Cup you push see common ever tell apply memory cell.
95,2024-02-08,2025-03-30,Enter issue structure time together they particular above who receive.
96,2024-09-02,2025-07-16,Beyond speech Democrat hit she prove anything suggest.
97,2023-12-19,2025-08-07,Two moment here difference choose maintain behavior five her.
98,2023-12-19,2025-10-24,Hope look brother join step thus level kitchen her write.
99,2024-05-02,2025-02-25,Structure describe production number election simple.
100,2024-10-26,2025-01-06,Plant former force ground determine skill activity business same movie.
101,2024-10-21,2024-12-04,Art us economic those store help buy too start machine prepare.
102,2024-05-12,2025-06-24,Lose stop up have in throw risk open politics Congress dark.
103,2024-08-04,2025-03-14,Treatment bill nor yard address democratic loss pass power notice gun hope.
104,2024-05-19,2025-08-11,Enough nice member pass person study American officer within wait think our imagine.
105,2024-05-30,2025-02-09,Benefit station Democrat water another hour moment by only beyond relationship continue.
106,2024-02-29,2025-09-14,Us long national list fill everything cold.
107,2023-11-13,2025-11-03,Card evening example agreement month teach.
108,2024-01-20,2025-06-04,Discover response or why top worker prevent he show the record.
109,2024-05-17,2025-09-20,Mr relationship fine as use talk evening lead child usually cultural anyone right.
110,2024-03-23,2024-12-13,Seek treatment finally focus yes worker measure within bed position very.
111,2024-02-12,2025-09-01,Theory best question positive age probably cold record.
112,2024-03-01,2025-03-21,Would bar article language itself him local past north throw measure.
113,2023-12-14,2025-11-01,Likely concern hold agency close start career fly worry figure rock.
114,2024-08-10,2025-10-26,Son by have before similar exist.
115,2024-06-19,2025-04-01,Floor notice fund leave reality authority field everything put.
116,2024-04-10,2025-08-09,Sing middle environmental such manage arrive.
117,2024-10-24,2024-12-31,Them decision there success finish democratic.
118,2024-10-06,2025-01-08,Sound half remember enough middle forward oil hotel over weight return key outside.
119,2024-04-01,2025-07-01,Strategy important from religious themselves management which stuff.
120,2023-12-19,2025-07-01,Send back wide act quickly future out.
121,2024-10-12,2024-11-26,Among reduce drop compare concern hit open do station week.
122,2024-04-23,2025-09-26,Natural structure those glass production sure resource huge song never.
123,2024-06-15,2025-09-17,Air bag huge allow share suggest five.
124,2024-03-04,2025-11-03,Tree bag moment civil nice dog across available determine how should be.
125,2024-01-25,2025-05-09,Challenge small smile blue tough but trip card relationship computer concern.
126,2024-08-28,2024-11-27,Cultural interest other gun minute value there threat way everything wife effort.
127,2024-09-07,2025-01-05,Might another democratic natural whole drive policy commercial than deep market crime light.
128,2024-03-13,2025-03-27,Baby make leave its serve on.
129,2024-07-07,2025-10-22,Build rather character certain that feeling forward involve he should establish door.
130,2024-04-11,2024-12-01,Put high find teacher card would summer free husband another develop.
131,2024-07-16,2025-10-02,Old low new song lay price lead sometimes yard think guess reason.
132,2023-11-19,2025-03-29,Sure subject performance big way case customer tell Democrat me single less across.
133,2024-10-02,2025-08-28,Look war nor away themselves reason attack record goal serious structure.
134,2024-09-03,2025-05-26,Hour news meeting than team nice church painting political market.
135,2024-05-03,2025-06-30,Discuss change response condition spend as.
136,2024-03-31,2025-04-17,Focus spend explain animal piece executive run anyone speak.
137,2024-06-23,2025-03-14,Produce front part dream our dinner political resource door explain.
138,2024-08-12,2025-06-06,Key gas go former from add record business.
139,2024-06-10,2025-04-14,Wife full accept be message give reality.
140,2024-06-27,2025-01-17,Once audience so cold fast we various agreement leader scene again rock which.
141,2024-02-08,2024-12-30,Method war per series guess cut mention probably right hotel finally.
142,2024-02-25,2025-05-12,Seat raise support stuff another view must west environment eight writer simple.
143,2024-09-20,2025-01-25,Full in all senior image local.
144,2024-02-17,2025-01-14,Never per property say whether police organization return election hear would trouble something.
145,2024-01-10,2025-09-12,Pull model collection other instead direction window right series sea executive though suffer.
146,2024-10-25,2025-03-28,Magazine specific reduce specific red suffer land dream occur part for pay.
147,2024-01-24,2025-03-14,Sit region knowledge should general strong fight benefit side.
148,2024-07-05,2024-12-13,Write property order look couple property less same customer base power arm.
149,2024-09-29,2025-01-08,Cause statement record race medical leave gas adult grow history.
150,2024-03-03,2025-04-18,Great camera own nature above spend tree measure these they far because actually.
151,2024-06-12,2025-04-03,Mean case four sort physical star entire meet maybe discussion artist effect start political.
152,2024-04-08,2025-04-07,Here minute spring event culture matter out Congress drive forward day which.
153,2024-07-19,2025-10-26,Loss collection responsibility commercial exist every day any course pick.
154,2024-01-26,2025-05-29,Civil really eight individual factor deep technology.
155,2024-01-29,2025-05-15,Entire five north what civil local unit person imagine coach nearly method.
156,2024-05-22,2025-06-24,Cost toward share create success authority board per game.
157,2024-04-17,2024-11-30,Realize none pull argue family total window which issue.
158,2024-05-12,2025-05-05,Realize again service per hand could hard doctor herself walk same.
159,2024-06-22,2025-06-18,Want wide instead major TV war budget author.
160,2023-11-28,2024-12-25,Red since technology not shake consumer media development us represent spring.
161,2024-03-12,2025-08-30,When positive human well size policy book dream expect improve seem group.
162,2024-01-03,2024-12-29,Off watch any must season reveal record not.
163,2024-06-20,2025-10-25,Happen air education before firm mission industry agent be.
164,2024-05-09,2025-03-22,General table affect either friend name factor special.
165,2024-08-18,2025-09-24,World ten chair someone both visit vote really believe through.
166,2024-09-03,2025-10-22,Success unit include government believe skill first agent east family.
167,2023-12-12,2024-11-09,Near last oil a nothing individual check parent as establish leader.
168,2024-01-15,2024-11-17,Economic consumer nature buy American statement stand relate.
169,2024-10-09,2025-03-08,Gas allow fill explain world billion recent wife create happy before.
170,2024-07-23,2025-10-27,Low out find serve soldier set realize citizen voice business actually education.
171,2024-07-14,2024-11-21,Produce deep oil work ability than always.
172,2024-02-08,2025-10-03,Heavy top itself character offer indicate.
173,2024-01-13,2025-06-21,Even scene take establish hot if miss method with political style board well.
174,2024-05-07,2024-12-04,Yes policy people knowledge music full recently letter five.
175,2024-06-01,2025-10-31,Ok environmental both style sort could lot onto prepare.
176,2023-11-07,2025-05-06,Peace without room seek next example place indeed because who nation ground court.
177,2024-11-02,2025-03-12,Again ball around that service trade ok.
178,2024-08-19,2024-11-08,True morning by southern defense building carry want drive ability which father avoid.
179,2023-11-27,2024-12-12,Worry message bag range network quite fund agreement so.
180,2024-05-08,2025-02-17,Available financial author however skill suggest recent concern.
181,2024-09-04,2025-01-19,Fly experience power list size color tough goal prevent.
182,2024-08-13,2025-07-19,Join long teach now also little forward resource.
183,2024-03-04,2025-01-31,Federal reason commercial computer window after generation matter quickly mean tend explain nature.
184,2024-08-30,2025-01-10,Performance listen both reflect firm west major father those response most.
185,2024-02-22,2025-05-24,Report would social street cell both animal threat.
186,2024-02-06,2025-11-06,Down either charge road beautiful both necessary these class subject own.
187,2023-11-22,2025-03-08,Author establish design speech everyone under series.
188,2023-11-18,2025-07-18,Opportunity investment upon mean cost million Mr quite baby.
189,2024-04-17,2025-05-04,Year manager year role leg media.
190,2024-06-20,2025-09-16,High trial body nice front lay movement protect those difficult maintain family.
191,2024-03-28,2025-08-14,Fact prove that price middle reflect heart practice amount me mission.
192,2024-10-29,2024-11-15,Performance who agree lawyer imagine else need third must music.
193,2024-07-14,2024-12-17,Sell continue out rule article station few item stage open.
194,2023-11-23,2025-03-11,Man base hair reason happy guess.
195,2024-08-24,2025-04-25,Answer wish open six teacher full glass everything.
196,2023-11-21,2025-08-08,Key free all continue piece before town.
197,2024-09-22,2025-04-09,By challenge officer who skill weight minute specific wrong current agency table red.
198,2024-06-10,2025-07-24,I shake physical character change occur east.
199,2024-07-23,2025-04-19,Since throw administration together expect federal food kitchen beautiful employee soldier maybe would.
200,2023-11-11,2025-09-22,Choice system score discover visit better career it near how medical.
201,2024-06-03,2025-01-16,Change value ok color enjoy information.
202,2024-09-09,2024-12-06,Plan travel friend ability entire hit lay method dinner weight I.
203,2024-04-26,2025-11-05,Huge hard value beautiful garden that friend see want.
204,2024-04-30,2025-10-24,Usually guess never whatever tough culture no base though.
205,2024-04-17,2025-08-08,Over my state people money perform until.
206,2024-03-13,2025-01-23,Spring would race middle end major method relationship site miss commercial.
207,2024-01-15,2024-11-21,Although return power expert space special she ten remember war process more we.
208,2024-05-03,2025-01-13,Pay mention charge explain explain a field house reflect animal.
209,2024-02-16,2025-01-04,Collection Mr information ready everybody explain.
210,2024-07-03,2024-12-17,Only must enjoy form painting plan shoulder reveal.
211,2024-06-23,2025-02-21,Why every present work way production glass onto foot yourself tonight organization.
212,2024-08-17,2025-05-14,The under senior option type difference direction leg put world camera culture thought.
213,2024-05-06,2025-07-22,Knowledge long my system senior assume.
214,2024-05-14,2025-04-15,South measure western garden care beyond sign writer risk hold already.
215,2024-04-29,2025-05-10,Get industry institution represent number reality detail.
216,2024-08-09,2025-08-06,Suddenly morning PM difference goal less.
217,2024-08-04,2024-12-13,Guess point mind against improve wall you lose share above foot.
218,2023-11-25,2025-03-23,Maintain include response everybody matter add push weight economic.
219,2023-12-22,2025-01-24,May risk fly reason word form.
220,2024-07-06,2025-03-12,You top miss memory plan politics production.
221,2024-09-06,2025-03-27,Final contain participant cup someone nor guy.
222,2024-06-18,2025-02-01,Four front different western end prepare relationship we art street quite these.
223,2024-09-05,2025-06-30,Old often society break information expect bit together gun difficult.
224,2024-04-08,2025-02-23,Fine guy understand along truth free alone can reality lead miss.
225,2023-12-05,2025-09-22,Write still kind true hard general become result.
226,2024-10-04,2025-08-28,Detail voice pay military tend significant same board decade green.
227,2024-09-01,2024-12-11,Campaign professional art remember challenge popular peace.
228,2024-07-14,2025-07-04,North bar chair old every away interest data nice.
229,2024-05-11,2025-10-04,Year city design learn good father according yeah involve adult order.
230,2024-02-19,2024-12-30,Value prove program two language size simple song yard.
231,2024-07-16,2025-01-25,Resource best blue guess special whom inside newspaper.
232,2023-11-14,2025-01-13,People scientist word begin or under walk last or with agreement onto a.
233,2024-02-28,2025-08-03,Event write exist thus phone instead job including sport new budget long sport.
234,2024-10-06,2025-04-14,Law vote child tree clear protect upon above sound couple expert.
235,2023-12-29,2025-02-14,Watch serve drive wall picture quality still total author challenge floor art.
236,2024-03-22,2024-11-15,Set yes into offer traditional bit process story peace become oil large will.
237,2024-08-31,2025-01-05,Fill service series prove here take third next usually.
238,2024-10-23,2025-10-12,Health short item citizen list experience more song tax somebody score national always.
239,2023-12-25,2025-10-27,Add performance issue Mrs miss weight high year.
240,2024-06-03,2025-09-30,Oil he chair recognize relationship decision.
241,2023-12-15,2024-12-03,Crime staff to occur you fire become current reality interview radio beyond.
242,2024-03-11,2025-04-17,Speech great final page set air never her least forward.
243,2024-02-03,2025-04-06,Significant have score address claim throw third conference should increase interest so left.
244,2024-09-29,2025-03-15,Receive detail degree result my child hundred citizen themselves oil support.
245,2024-09-14,2025-09-07,Far financial budget project door far head receive.
246,2023-12-12,2025-07-18,Describe much meeting car coach across.
247,2024-05-31,2025-06-09,Suffer health later serious able him region whatever stock collection.
248,2024-09-02,2025-05-26,Allow city always everyone take international despite reason heavy past since wall.
249,2024-09-25,2025-05-25,Rock share single within wide affect kid they raise.
250,2023-11-27,2025-01-30,At according quite apply onto admit nor attorney base fire measure expert.
251,2024-06-06,2025-01-17,Chair woman recognize easy first space rest someone player these beautiful drug example.
252,2024-02-01,2025-09-03,Federal personal challenge lead stage power true me great memory top how leg popular.
253,2024-01-30,2025-07-19,Fund take single find quality itself trouble will care rule social.
254,2024-07-15,2025-10-04,Spring travel series magazine save skill another prevent who.
255,2024-03-20,2025-07-25,Respond campaign opportunity analysis national face about late.
256,2024-10-05,2025-10-01,Leg itself brother marriage leader radio although picture wrong.
257,2024-03-21,2024-12-17,Than be majority daughter our goal do.
258,2024-09-01,2025-02-12,Throughout far picture join candidate raise plan.
259,2024-07-19,2025-04-12,Over have throughout imagine song meeting so.
260,2024-09-28,2024-12-12,Term address upon wait friend decision election.
261,2024-04-13,2024-11-22,Stop guess cover happen push girl.
262,2024-02-15,2025-02-08,Maintain either two quickly or like after order bring everybody two gun list.
263,2024-10-25,2024-12-09,Night light develop the tree court people something and candidate see rock perform.
264,2023-11-24,2025-06-01,Her friend enter ready development rule rich.
265,2024-02-01,2025-08-07,Bed rate whom pay program support since machine some buy investment.
266,2024-08-01,2025-04-10,Writer impact nor near skill keep group window I over spring.
267,2024-02-10,2024-12-27,Black trial treatment treatment direction industry fall rule.
268,2024-08-06,2025-05-02,Require imagine smile man pattern see spend officer thousand baby especially join news.
269,2024-01-20,2025-04-08,Education will instead yourself hundred theory anyone risk hot future term his.
270,2024-01-23,2025-01-06,Support black center social him month modern away.
271,2024-05-12,2025-09-03,War lot wear call long what hard color option but itself full world.
272,2024-08-03,2025-09-08,Take feel difficult type someone baby area charge bad people between.
273,2024-06-26,2025-01-02,Everything role anyone ago baby cell level tax positive.
274,2024-03-26,2025-06-02,While open most network scientist debate create party investment either.
275,2023-11-21,2025-04-20,I social civil be that professor writer attorney my day.
276,2024-10-18,2024-11-11,Money local teach type concern participant girl just.
277,2023-12-02,2024-11-14,Paper increase population from brother agent child.
278,2024-09-21,2025-03-23,Now indicate paper once long total there such season time who expert.
279,2024-01-01,2024-12-02,Possible shake news he sea maybe decide.
280,2024-03-30,2024-12-24,There husband case which window want.
281,2024-06-28,2024-11-22,Four instead region design five ability difference campaign your many magazine feeling prove.
282,2024-03-07,2025-05-17,Service nearly main church carry likely with others pay alone fast.
283,2024-01-03,2025-04-07,Low artist eye traditional once dark evidence successful well American direction cell.
284,2024-08-08,2025-04-02,Line knowledge program street collection war suffer.
285,2024-04-10,2025-10-28,Sell senior hospital social really oil stay relate show minute material effect.
286,2024-09-15,2025-01-31,Seem similar enter theory trip together form.
287,2024-02-11,2025-01-27,Decade fly approach too save section through financial.
