homework_id,assign_date,due_date,description
572,2024-05-25,2025-04-01,Close wish whom bar range thought large month.
573,2024-03-22,2025-06-01,Hour training common she minute imagine.
574,2024-03-03,2025-02-24,Pay become party safe five scene religious dark center.
575,2024-08-21,2025-04-04,Great people expect price during within.
576,2023-11-07,2025-06-03,Ahead involve institution situation but marriage you until military.
577,2024-01-22,2025-03-26,Time even huge visit whose high stay want tax.
578,2024-03-30,2025-01-03,Local bad material land skill key world much worker power listen area.
579,2024-08-06,2025-03-10,Product have gun matter future thousand Mr soon fact respond along pressure.
580,2024-08-19,2025-06-24,Responsibility physical some institution remain kind last collection.
581,2023-11-20,2025-04-03,Work including evidence without environment police film recognize.
582,2024-08-10,2025-08-06,Machine player wind lead energy operation after nearly program summer agreement design mind.
583,2024-03-03,2024-11-29,School where join wind firm heavy tree seat many.
584,2024-02-14,2025-05-11,Offer speech shoulder month power street recent service.
585,2024-05-30,2024-12-30,Action hear all rather win seem news head personal big.
586,2023-11-11,2025-08-04,Themselves box four pull control military three thousand go argue agreement year.
587,2024-02-04,2025-08-25,Hospital military where low simply yard while house letter well fast up able.
588,2024-02-16,2024-12-14,Notice stock learn develop despite try coach upon trial measure old study.
589,2024-06-13,2025-09-06,Natural cover someone thing south blue view sing.
590,2024-03-10,2024-11-16,Actually clearly maybe role baby method space kind land stuff leg.
591,2024-05-05,2025-08-08,National money red beyond though might federal arm long.
592,2024-07-05,2025-05-24,Price campaign product down another grow source capital program Democrat same push me.
593,2024-06-18,2025-10-23,Fine car within make step real.
594,2023-12-29,2025-10-29,Say long claim million edge theory understand one.
595,2024-05-24,2025-06-19,Watch ok human large husband direction water management plant.
596,2024-07-28,2024-11-30,End see land camera church respond carry.
597,2024-04-10,2024-11-25,Deep black everybody traditional degree race house forward.
598,2024-04-15,2025-07-06,Quickly agent result boy accept PM exist here help scientist class area.
599,2024-09-01,2025-04-02,Still Mrs meet vote article administration.
600,2024-02-01,2025-06-27,Down develop herself necessary check character respond physical move tree same generation behavior.
601,2024-02-04,2025-09-28,Fall Mrs information experience man story discover travel.
602,2024-08-08,2024-11-15,Rise explain catch stop decade radio because than receive ready system keep.
603,2024-10-07,2025-01-16,Production check away four could wonder.
604,2024-06-08,2025-10-22,Music enough go report strong fall Mr room local Congress red.
605,2024-03-21,2024-12-15,Poor campaign lead it free no single.
606,2024-10-14,2025-01-09,Themselves heavy television stock us foreign.
607,2024-10-13,2025-09-19,Culture mother section first court subject artist dog somebody share court.
608,2024-02-16,2024-11-26,Woman senior friend parent growth fine candidate kid.
609,2024-08-09,2025-02-19,Must case front hear new character hour decade third.
610,2023-12-18,2025-01-03,Modern local staff just author themselves whose good break.
611,2024-06-03,2025-10-25,Sell politics election feel do standard.
612,2023-12-11,2025-03-27,Change notice traditional degree left plan office.
613,2024-07-16,2025-03-20,Focus identify even middle others policy view.
614,2024-03-10,2025-06-22,Task pattern simply front defense energy ok just.
615,2023-12-01,2024-11-18,Into enjoy however friend keep old game hold effect.
616,2024-05-04,2025-09-10,Rich others produce improve interest skill but paper.
617,2024-03-30,2025-09-02,Receive author capital west always eat seem assume no marriage guy fire.
618,2023-12-07,2025-06-20,Food interesting maintain idea laugh phone develop.
619,2024-01-16,2025-08-27,Teach rather art anything top name keep bill election stop.
620,2024-01-04,2025-06-03,Realize sign whether his economic reveal something same defense let film writer popular.
621,2024-06-07,2025-08-08,Commercial raise land be everyone then.
622,2023-12-30,2025-08-14,Build within task good everything follow scene commercial space white pass.
623,2024-10-05,2025-04-21,Question us property as list here organization ground education few.
624,2024-02-15,2025-06-21,Allow foreign policy yet television area him remain.
625,2024-06-20,2025-01-17,Industry new boy usually finish officer town language mind loss.
626,2023-12-17,2025-09-29,Ok order store program stock catch.
627,2024-07-14,2025-10-11,Season public more how become say break.
628,2024-05-06,2025-09-09,Design huge performance notice let better mouth pay development him system.
629,2024-05-03,2025-10-03,Boy why population son education gun radio.
630,2023-11-18,2025-01-13,Certainly from little begin thus popular.
631,2024-01-01,2024-12-17,Success general dream cold argue step inside gun treat discussion offer class.
632,2024-05-03,2025-10-02,Play everybody arm win know my him financial culture city effect both can.
633,2024-03-19,2025-04-23,Myself role note drop lose green run son visit develop stay audience girl.
634,2024-10-18,2025-07-25,Simply tonight indicate order wife season social which usually trial worry bed.
635,2024-02-20,2025-07-06,Probably painting animal general not everything discover feel I knowledge method last million.
636,2024-01-30,2025-09-07,Painting tax cultural outside build like somebody six mind off.
637,2024-01-18,2025-04-01,Might special maintain pass soon about those doctor cell on.
638,2024-09-04,2025-02-20,Trial accept amount check reflect shake either suggest case.
639,2023-12-06,2025-06-13,Company million simple player great Democrat choice weight avoid.
640,2024-03-04,2025-02-27,Degree garden medical medical film reality president.
641,2024-09-23,2025-05-29,Each assume agency difference section she dream increase sing she within.
642,2023-12-05,2025-08-15,Minute modern statement any cost series simple article appear southern defense.
643,2024-03-05,2025-01-21,Everything read them perform wonder fill remember specific anything laugh someone sure any.
644,2024-05-07,2025-04-15,Including receive other teacher while wall.
645,2024-09-21,2025-10-26,Upon close instead six own prevent interesting let.
646,2024-04-18,2025-01-14,Despite he simply film style machine.
647,2024-10-31,2025-09-30,Experience population south item author table trade.
648,2024-07-02,2025-07-18,Commercial sound first sort memory news.
649,2024-07-23,2025-01-18,Deal service range control grow from.
650,2024-06-27,2025-08-02,Single fine dinner well pressure risk business anything game far.
651,2023-12-03,2025-02-03,Soon and source current life part season foreign charge discover energy.
652,2024-01-01,2025-02-22,Maybe bag outside report answer five get study customer.
653,2024-02-15,2025-03-12,Can truth arm despite particular according budget them.
654,2024-08-02,2024-11-15,Magazine too best television shake reality his piece effort recognize soldier.
655,2024-09-13,2025-02-04,Hand over piece officer six decision remain way.
656,2024-09-26,2025-07-14,Job magazine significant someone discussion month blue up study.
657,2024-08-10,2025-05-24,Born box any fall person to capital court.
658,2024-01-03,2025-01-31,Take finally true everyone arm four several one break recognize born party best.
659,2023-11-27,2025-04-05,Each nation take relationship approach history beyond indicate ago song talk.
660,2024-02-18,2025-03-14,None security street appear sometimes enjoy agreement special sense later daughter art.
661,2024-04-09,2024-11-16,Also moment anyone set operation participant generation your probably.
662,2024-08-02,2025-03-11,Yard week push guy continue decide dinner poor baby resource.
663,2024-04-21,2024-12-17,Value always less newspaper get gas bit section treatment consumer stage well scientist.
664,2024-08-28,2025-04-23,Would common store next close line already series heavy money.
665,2023-12-02,2025-10-17,Side thousand their with challenge change decade nothing.
666,2024-09-22,2025-10-16,Particular deep certainly home color exist involve unit break determine street stop picture.
667,2024-08-31,2025-09-05,Respond also number hand soon cup laugh decade fall.
668,2024-07-30,2025-09-26,History side single education image pretty.
669,2024-03-27,2025-08-07,Control son individual just nor news firm fact decide.
670,2024-01-01,2025-03-17,Bag yes concern structure board group figure art whose structure man.
671,2023-12-29,2025-10-26,Strategy century brother country southern beautiful above.
672,2024-01-31,2025-02-06,Policy production great meeting we politics far use every draw.
673,2024-07-20,2025-09-15,Detail level per set while figure trip consumer left mean finish.
674,2024-06-19,2024-11-10,Soon mean space individual among break.
675,2024-02-15,2025-04-16,Wish political do why yourself education young.
676,2023-12-27,2025-08-26,Wall future history wonder wall item sing hit reach management model radio.
677,2024-04-28,2024-12-13,Sit three you note finally agent would thousand.
678,2024-08-10,2025-02-24,Ten source song learn moment voice front hold give sea ask bed rest.
679,2024-10-02,2025-09-13,Present early choice I research bed test.
680,2024-03-07,2025-09-17,Serious arm society me about yard member able peace health.
681,2024-05-12,2025-02-15,Language trouble travel factor garden election piece imagine challenge.
682,2024-07-18,2024-11-29,Letter successful standard court can seek.
683,2024-09-12,2025-03-03,Daughter into policy bag four statement television first four her might.
684,2024-02-07,2025-02-23,Its town care instead difference practice.
685,2024-01-31,2024-11-28,Him thought many old Republican skill woman.
686,2024-07-04,2025-06-13,Develop around player able receive onto.
687,2024-02-27,2025-05-22,Card unit rich near suggest like represent try military exist political.
688,2024-08-07,2025-07-30,Security fire player store rise entire nothing.
689,2023-12-11,2025-01-22,White half manage set sit series back situation trip process quite know ten.
690,2024-02-20,2025-03-02,Car pay public artist leave by quite represent resource weight sing race director.
691,2024-01-09,2025-04-06,Blood piece body phone now reality identify.
692,2024-04-18,2025-03-13,Ready south push war law wonder agent truth change I thank production.
693,2024-10-25,2024-12-12,Skin kitchen forward finish Mrs economic shake why.
694,2024-02-29,2024-12-13,Open term special interest he senior citizen hard direction only value.
695,2023-11-12,2025-03-06,Mrs present spring nature either organization laugh we sing choose challenge appear.
696,2024-08-20,2025-02-15,North finally husband worker assume size imagine without red may.
697,2023-11-21,2025-02-22,Everything hospital too billion college five.
698,2024-07-16,2025-10-26,Chance perhaps film sign number exactly reach professor adult least front already.
699,2024-09-25,2024-12-25,Discover fast according why could receive executive learn quite human never improve act.
700,2024-03-17,2025-10-04,Far line activity life production use people western.
701,2024-04-13,2024-12-15,Field practice deal score product actually woman son woman.
702,2024-05-18,2025-08-07,Future again friend benefit actually say after.
703,2024-08-17,2025-01-21,Home role do make kid move quickly stuff study prevent pass.
704,2024-01-24,2025-02-13,Worker pass since leg because season hard beautiful camera hard question move environment.
705,2024-10-23,2025-06-09,Machine leave why example white check.
706,2024-06-27,2025-10-24,Agreement doctor design open natural character prove fact public go sign evidence.
707,2024-02-17,2024-12-06,Two very possible great role far area book sport.
708,2024-10-17,2025-06-08,Rather available often with consider almost set easy you we father.
709,2023-11-17,2024-12-19,Well do if level front seek point use prepare history skin.
710,2023-12-05,2025-07-31,Add approach evening up everyone break five former.
711,2024-10-09,2025-10-09,Send executive population seat bar from.
712,2024-10-03,2025-02-07,Quite nation race during city set.
713,2024-05-03,2025-01-13,Voice even ability three visit animal grow day area care federal imagine of.
714,2024-04-29,2025-08-07,Catch true discover might have account place protect week rather.
715,2024-05-02,2025-07-06,Hear away final decision official guess feel beyond prove build attention.
716,2024-05-28,2025-10-20,Production late care statement ball white month.
717,2024-04-20,2025-06-17,Art any political none view crime key detail different occur of husband.
718,2024-01-03,2025-09-12,Card which major line news might fight ever civil war suddenly seem.
719,2024-07-05,2025-01-21,Ahead item true away bill admit brother through group newspaper contain consider.
720,2023-12-17,2025-10-13,System continue class clearly continue two present executive himself.
721,2024-02-01,2025-06-23,Top than trouble difference finally maintain including.
722,2024-07-15,2025-04-05,Effort form effect threat box at them actually relationship mean think these environmental.
723,2023-12-03,2024-12-21,We including miss small blood investment look another field toward.
724,2024-06-21,2025-03-23,Subject discussion song myself would light energy prepare ability character minute fund.
725,2023-12-06,2025-05-15,Night us minute enter state operation woman while last.
726,2024-01-24,2024-11-16,Base else try police south heavy sort service.
727,2024-05-13,2025-02-16,Executive medical gun worry suggest cold along world identify standard.
728,2024-09-06,2025-06-23,Imagine space happen glass weight address along government.
729,2024-09-26,2025-03-27,Often ground enough manager article family energy carry thing test us hear set.
730,2024-09-12,2024-11-23,Option reality although security tell thing even return.
731,2024-07-25,2025-06-27,Become pass put move design even hand PM eight media.
732,2023-11-11,2025-08-12,He history teach car clear tonight improve experience.
733,2024-08-03,2025-09-13,Enter though change son reduce TV security early break use can appear her.
734,2024-10-24,2024-11-08,Study call model foot long into call mention when would small painting.
735,2024-07-04,2025-01-28,Future physical front firm take end.
736,2024-03-04,2025-02-27,Probably next event back item middle where music feel ability.
737,2024-10-24,2024-12-05,That become his should shake matter body together.
738,2024-04-17,2024-12-19,Organization subject need goal still or challenge.
739,2024-08-04,2025-08-18,Easy sit president behavior seem tree control apply when I.
740,2024-08-28,2025-10-09,He example on hard force sometimes travel dog evening ten.
741,2024-03-27,2025-02-27,Happen quickly necessary them treat size machine yard year woman want create.
742,2024-06-06,2024-11-09,Pick laugh source open economy television know rather what easy lot stand against.
743,2024-10-27,2025-01-19,International fast first state management kitchen trip size against.
744,2024-08-02,2025-02-01,Important stop sometimes spend those while ready city respond rate explain human.
745,2024-09-05,2025-03-05,Small peace work stand few drop source trade discover while yet professional left.
746,2024-11-05,2025-11-03,Central tonight model here audience thing team.
747,2024-01-16,2025-05-31,Statement fall nearly customer truth want.
748,2024-08-06,2025-08-05,She least out sell bag risk own indeed win area here expert beyond.
749,2023-11-28,2025-06-05,Western become college scientist view Mrs bed administration including.
750,2024-09-05,2025-07-14,Model produce air control choice ready tell tough player.
751,2024-09-15,2025-02-06,Technology watch last population society parent fall.
752,2024-07-23,2024-12-26,Evening serve arrive third tough effect card successful job century technology.
753,2024-09-15,2025-10-25,Forget for wide peace happen choose work personal structure box moment teach skin.
754,2024-01-14,2025-04-17,Medical country information rule music social.
755,2024-03-10,2025-01-19,Face debate morning probably hospital wonder hotel mouth cover always series.
756,2024-03-18,2025-06-13,Right fish yeah rather him soon loss increase.
757,2023-11-09,2025-06-23,When someone explain first marriage year themselves agency newspaper day wrong.
758,2024-08-17,2025-05-02,Especially process position lose beyond student get red.
759,2024-04-27,2025-01-09,Opportunity instead make operation do but strong exist quite really myself lay.
760,2024-01-15,2025-06-27,Here former bill cut effort understand.
761,2024-05-08,2025-01-06,Adult expect or can laugh issue itself necessary production end.
762,2024-05-16,2025-10-29,School analysis media sing benefit physical government word.
763,2024-06-19,2025-10-26,Test attention family against writer itself plant class.
764,2023-12-17,2025-08-27,Authority power again out help effort far example shake table others identify.
765,2024-05-28,2024-11-13,Throughout movement different run very floor why.
766,2024-05-05,2025-10-26,Key whether red strong effort wind my hair will travel reveal pattern as.
767,2024-05-28,2025-06-13,Boy game keep natural work argue.
768,2024-08-14,2025-10-26,Decision yeah large market result hotel.
769,2024-06-09,2025-10-07,Build view account four throughout too anyone gun use case want shoulder growth somebody.
770,2024-03-15,2025-08-24,Matter address cut fine alone up happy mean.
771,2024-01-01,2025-08-20,Travel executive tree inside rock new hundred.
772,2023-11-16,2025-03-19,Hot may machine recognize money but agree politics play whether.
773,2024-02-11,2025-09-20,Close wonder loss explain measure choice very admit room reason perhaps control eat.
774,2024-06-21,2024-11-22,Matter general article fight sense safe theory right somebody less sometimes stage.
775,2024-02-24,2025-07-12,Central country answer phone to I baby your assume leg rock music space.
776,2023-11-26,2025-02-17,In enjoy somebody PM anything step phone center over notice friend.
777,2024-07-09,2025-07-22,Decade thank group down special mouth art although least.
778,2024-04-24,2025-07-03,Officer rest discuss pay four personal item.
779,2024-07-16,2024-12-04,Around red east agree season identify similar operation nothing institution.
780,2024-04-28,2025-06-17,Have agreement much reason evening true control build certainly condition deal last.
781,2024-07-07,2025-10-18,Reduce though read fear every executive matter debate central anyone store level.
782,2024-09-21,2025-05-31,For baby budget know course research issue.
783,2024-08-28,2025-06-20,Nation reflect party same law war new leg.
784,2024-10-24,2025-06-13,Would allow black style seat because television role people.
785,2024-03-03,2024-12-17,Child million hair home senior test story.
786,2024-01-14,2025-04-27,Shoulder send court section several some.
787,2024-01-12,2025-05-22,Away rise show draw during play then think everybody ever material decision.
788,2024-07-27,2025-06-10,On past possible read price join real operation set perhaps lawyer candidate than.
789,2024-04-05,2025-05-04,Company their including threat tough activity rise always offer though final.
790,2023-11-10,2025-01-18,Catch beyond me quality total chair situation true series fill also song.
791,2024-09-19,2025-01-05,Find represent drive middle base number agree stock plant certain light myself everyone.
792,2024-02-16,2025-03-31,Ok watch foot apply financial plant compare always.
793,2024-02-25,2025-03-09,Never set bill laugh left above impact movie.
794,2024-08-14,2024-11-11,Number marriage beyond set suffer instead two stop game day see buy.
795,2024-09-10,2025-06-11,Tend heart base good war past.
796,2023-12-12,2025-08-03,Address I military follow think price officer experience attention choose week owner cause.
797,2024-07-07,2024-12-30,Training meeting within nature its customer base southern.
798,2024-01-19,2025-06-25,Much difficult offer American successful wish.
799,2024-09-10,2025-10-27,Model hear forward out expert rule as letter open conference sure yes budget.
800,2024-05-10,2025-05-15,Language management sing sing such talk class.
801,2024-07-15,2025-03-12,Until time traditional note perform knowledge development risk military.
802,2023-12-27,2025-10-19,Now rise he stock generation relationship training.
803,2024-10-14,2025-09-18,Security dark wrong over loss carry generation manager while.
804,2024-03-10,2025-02-07,I computer crime difficult huge American could energy argue officer fact as anything.
805,2024-04-20,2025-10-11,Economic economic street face few sea describe property.
806,2024-02-26,2025-04-16,People assume officer know listen lose what culture ground feel.
807,2023-12-21,2025-05-24,Anything good tree of brother respond strong less.
808,2024-03-02,2025-09-18,Why show themselves president leave attention rich.
809,2024-04-05,2025-01-18,Long bring than wife physical police room risk.
810,2024-09-09,2025-07-15,Main benefit any fact very bar west anyone.
811,2024-07-22,2024-11-12,Now toward off either example meet likely allow late near decade simple read.
812,2023-11-15,2025-03-18,Executive through organization life let leader put find keep without avoid.
813,2024-10-14,2025-06-30,Raise the performance order window return position item business big.
814,2024-06-26,2025-10-02,Others particular claim gun eight best in discuss together listen bed.
815,2024-01-22,2024-11-25,Activity spend quickly minute anyone occur home.
816,2024-06-01,2025-02-23,Purpose information detail not right personal record.
817,2024-05-08,2025-11-03,Reveal try though sing thought up decision argue design health across together.
818,2024-10-11,2025-11-03,Old positive of teach memory sign bank hotel east month class soon.
819,2024-02-27,2025-10-01,Mean majority base film whose pick suffer my process his skill.
820,2024-01-08,2025-08-17,While out skill line particularly stuff with read effect.
821,2024-01-30,2025-07-01,Science behavior buy real own business movement.
822,2024-04-29,2025-08-08,Two over example fill condition begin five loss dream political clear.
823,2023-12-30,2025-08-04,Land safe yet still miss with when write some onto fall stay.
824,2024-11-05,2025-04-26,Task generation rate west top whatever focus account woman music body.
825,2024-04-07,2025-07-16,Rather store pass stay parent start will under.
826,2024-01-18,2024-12-15,My sea who mean student girl discuss defense.
827,2024-05-30,2025-06-07,Mind mention save do water international which student cut keep.
828,2024-06-22,2025-07-25,Book nice arm least foot real national together than play.
829,2024-11-06,2024-11-21,Bar region see let peace situation step war reason I.
830,2024-05-16,2024-11-09,Test any population believe from might student middle his.
831,2024-06-21,2025-05-02,Drop mind writer help meeting realize the standard she prevent month drug own.
832,2024-02-04,2025-05-06,Along marriage life vote bring natural thus perform American single dream center.
833,2024-10-23,2025-02-10,Any enough above finish bill civil our poor middle can car.
834,2024-05-09,2025-06-02,Argue focus still across spring capital success practice by entire first describe ball.
835,2023-11-11,2025-02-14,Product law feel should bill course.
836,2024-05-26,2025-05-23,Store today nature air young be nice send partner agent.
837,2024-08-14,2024-11-15,System standard piece race too feel bring challenge find strategy why upon imagine.
838,2024-03-29,2024-11-08,Include learn other on play article could.
839,2024-05-14,2025-09-04,Everybody exactly meet leg way report born despite language kind space for.
840,2024-03-18,2025-03-27,To value analysis determine tree security.
841,2024-01-30,2025-05-11,Stay recently agree enjoy decade every.
842,2024-08-02,2025-06-22,Less issue minute energy spend them all idea boy tree.
843,2024-09-18,2025-01-17,Blue picture cell southern particularly debate him blood movie response perform.
844,2024-03-25,2025-04-24,Dream role stay theory term coach specific interest art open clear.
845,2024-04-02,2025-03-01,Middle compare position beautiful recognize since PM without call so produce.
846,2024-03-13,2025-04-03,Stage base whole south very activity exist war increase people visit find.
847,2024-01-27,2025-09-18,Picture way name small practice we significant national rich.
