homework_id,assign_date,due_date,description
288,2024-02-17,2024-12-09,Benefit dream image evidence poor land none check treatment around model add.
289,2024-08-16,2025-10-10,Discuss power even east organization bad expert class even represent.
290,2023-12-30,2025-10-22,Skin eye by time child common time information skill tend.
291,2024-08-19,2025-02-13,Enough scientist event at security history none.
292,2024-10-10,2025-10-20,Head everyone central fact memory various voice affect.
293,2024-01-08,2024-12-24,Mention yes involve opportunity because security result trade.
294,2024-09-08,2025-10-08,Imagine it middle condition smile seek firm eye notice case car life next.
295,2024-07-04,2025-09-19,Another service Mr success huge nature read.
296,2023-11-10,2024-12-17,Coach same analysis often or ground beautiful machine.
297,2024-04-30,2025-09-22,Car nearly property commercial local seem positive myself.
298,2024-08-16,2024-11-22,Best summer course letter table white return past.
299,2024-03-17,2025-09-15,Population might determine rule have wear section dark though amount foot process.
300,2024-09-07,2025-10-04,Off close glass level movement guy authority.
301,2024-06-01,2025-10-25,Total trouble hard plant especially film answer attention piece and college ground.
302,2024-04-22,2025-05-25,Require many yet set better brother serve.
303,2024-04-24,2025-04-08,Claim wrong push soon want here tree.
304,2024-04-19,2025-08-23,Kitchen by performance south above respond information machine long black enjoy star ten.
305,2024-05-05,2025-01-09,Modern page any Mrs indeed rate ground election collection feel if thing buy.
306,2024-07-18,2025-02-27,Ask deal foreign mean standard brother often industry born phone.
307,2024-01-07,2024-11-23,Lawyer suffer someone true lead three.
308,2024-04-14,2025-06-03,Major force tend state under sound natural north mouth control health.
309,2024-04-26,2025-05-06,Congress politics rather sign least surface catch.
310,2024-06-18,2025-08-24,Eat but risk sit fly box including growth walk process race fast reflect.
311,2023-12-05,2025-06-24,Film another sort out billion tax a window toward seat require hospital pattern.
312,2024-09-15,2025-02-18,Place grow them test sister life program mouth foot thing stop sing couple.
313,2024-09-01,2025-08-19,Age use help thought enough culture stay produce across center.
314,2024-04-22,2025-06-24,Represent use fire far simple follow break old great claim.
315,2024-04-14,2025-10-21,Wonder cut nothing than student day.
316,2024-04-24,2024-12-23,Throw day fine popular green whose year over art most occur age.
317,2024-06-03,2024-11-18,Husband fall who stuff of help business.
318,2024-09-27,2025-01-03,That build range low nearly ask explain entire.
319,2024-09-16,2025-03-22,Until hospital bring media several however along success so.
320,2024-10-13,2025-06-29,Notice soldier husband dream whose she message move ask account.
321,2024-09-02,2025-04-11,Most never both whatever simply finally subject wide cover nice.
322,2024-08-12,2025-09-03,Occur teacher trial business important edge compare give argue provide car environment message.
323,2024-06-27,2025-05-13,Explain along find toward rich I be head.
324,2024-06-19,2025-11-02,Policy officer toward finally themselves heavy history training ask amount security.
325,2024-05-26,2024-12-04,Determine Mrs law believe help improve Mr attack pay stay keep.
326,2024-02-02,2025-08-29,Gun PM hard data example five order drive space network life draw television.
327,2024-05-21,2025-07-18,Baby we six them enter sense fast.
328,2023-12-25,2025-06-01,Important bring charge someone believe discussion house this also human strong cultural.
329,2024-07-09,2024-11-11,Exactly loss bring field investment door store seven hundred large window door citizen.
330,2024-11-03,2025-06-01,Television continue wrong claim require seem wife face late.
331,2023-11-21,2025-03-07,Firm side lay play true machine important.
332,2024-03-12,2025-08-11,Clear family or all top hard born week give their.
333,2024-06-26,2025-07-15,True white building few research spring message.
334,2024-06-16,2025-01-10,Shake admit father yes discover cause since soon several mind door.
335,2024-04-23,2025-03-13,Hope protect everybody thus direction protect though role no not.
336,2023-12-30,2025-04-22,Nothing wide different garden time off pressure industry throw.
337,2024-08-04,2024-12-12,Though include already one method all.
338,2024-04-10,2025-08-05,None sometimes he office hospital whom special interesting by discover.
339,2024-05-03,2025-08-22,According effect either form positive goal personal if authority structure realize.
340,2024-01-12,2025-10-18,Somebody front tree least lawyer born table.
341,2023-12-13,2024-12-29,Anyone bit loss there become decision difference factor.
342,2024-02-11,2025-10-06,Floor claim something sense throw executive foot knowledge blue senior word claim political.
343,2024-04-17,2025-08-14,Finish less either site total bag do will.
344,2024-01-03,2025-03-24,By sure official despite above break.
345,2024-01-02,2025-05-16,Actually long create care in job today could represent physical sense.
346,2024-03-10,2025-07-21,Would voice season themselves war system five cut ask quality race important.
347,2024-10-30,2024-11-17,Human professional account politics leader research animal war industry true almost of.
348,2024-04-25,2024-12-10,Money officer party to apply notice loss employee girl decade pay his.
349,2024-05-25,2024-11-23,Prepare probably control exactly picture their policy with member term.
350,2024-09-04,2025-09-09,Man bad clearly subject their wall purpose.
351,2024-08-13,2025-01-07,Subject more great identify attorney wrong hundred factor identify middle environmental use.
352,2023-11-18,2025-06-13,Above top reason PM threat cut service others.
353,2023-12-20,2025-06-29,She move step degree community town.
354,2024-01-25,2025-02-05,Return commercial blue industry international difference continue feeling simply indicate break sometimes test.
355,2024-10-07,2025-07-29,Main bag born left business middle study cut.
356,2023-12-03,2025-04-13,Impact green several information necessary scientist above thousand challenge food environmental several hear.
357,2024-01-08,2025-02-10,Know whose each from certainly condition thank entire find travel positive listen some.
358,2023-11-24,2024-12-14,Manager skill court somebody him wide write.
359,2024-08-03,2025-04-18,Business common process out knowledge structure boy we daughter book.
360,2024-03-24,2025-07-31,Mrs history well yourself father whom modern across thank peace.
361,2024-10-26,2025-06-27,To friend buy almost your event truth office.
362,2023-11-27,2025-08-31,Return peace man information artist information sister.
363,2024-05-17,2025-04-03,Use culture establish early establish later increase stuff allow civil let pressure record.
364,2024-10-22,2024-12-23,Perhaps economy approach trip ability data already next.
365,2024-03-29,2024-11-08,Light center us church while week should year wind situation remain.
366,2024-04-07,2025-01-12,American although over new organization audience lot.
367,2024-01-24,2024-12-24,Individual public might meeting defense camera administration health chair writer draw.
368,2024-02-29,2025-07-24,Me later law reflect involve first finally.
369,2024-01-14,2025-03-31,Help water Democrat value stock fund than international several.
370,2024-08-13,2025-08-01,Four suggest environment trouble look record these easy dream dog operation each body.
371,2024-06-09,2025-04-23,Power difference democratic fact commercial morning happen power if message.
372,2024-05-15,2025-02-27,Hold traditional billion area across seat store democratic information.
373,2024-09-25,2025-03-06,Near two natural expert direction former worry.
374,2024-04-03,2025-01-02,Particularly view leg number act minute light wall whether relationship performance director.
375,2024-03-20,2024-11-11,Individual up entire spend across court oil have song policy whom education.
376,2023-11-29,2025-04-10,We between environmental science bag represent minute truth young break.
377,2024-10-12,2025-06-21,Kid we fact language professor catch others represent doctor bad.
378,2024-05-28,2025-08-25,Successful interest view move prove generation form when answer spring in maintain.
379,2024-04-27,2025-06-20,Surface choice operation many themselves team practice grow sound join like.
380,2024-10-05,2025-04-23,Ground suddenly end president glass six number company out build cause away.
381,2024-10-20,2025-04-17,Room wish executive record mother nearly clear building better why since hair politics.
382,2024-08-03,2025-01-08,Congress these can against wind lose me.
383,2023-11-07,2024-12-11,Special theory evening year conference sing amount.
384,2024-08-10,2024-11-20,Could way thank season evidence only.
385,2023-12-09,2025-03-19,Military very across look yet each which continue address.
386,2024-07-14,2025-09-03,Wrong piece arm fish thus often culture bar benefit gun.
387,2024-07-27,2025-10-12,Hard rule soon student actually economy course less case special war break.
388,2024-03-16,2025-10-08,For training clear best only letter value fire walk everybody where rise.
389,2024-04-30,2025-04-05,Military figure game relate ground method edge marriage.
390,2024-01-06,2024-11-28,Detail arrive increase threat major once national.
391,2024-02-13,2025-01-01,Board teach wide receive item would one without.
392,2024-11-01,2024-12-27,When be as argue finish author create personal read.
393,2024-08-10,2025-08-26,Thousand force government issue administration send born example economy.
394,2024-05-11,2025-03-31,Always commercial cultural form whether common.
395,2024-08-13,2025-02-17,Area learn tend own policy upon meet watch behavior.
396,2023-12-30,2025-10-18,Full key air key opportunity catch own smile program source charge appear measure.
397,2023-11-19,2025-07-16,Subject relate natural movie serious play sound test brother chance consumer.
398,2024-03-16,2025-06-24,City beyond white she success enjoy data management attack will end.
399,2024-04-29,2025-06-15,Woman example adult treatment first on represent check animal total crime learn.
400,2024-04-23,2025-08-12,Past drop boy usually rich very culture lay Democrat community in.
401,2024-03-14,2025-08-19,Enjoy live stand usually wait treat.
402,2024-02-06,2025-06-17,Response your process remain rather trade arrive woman.
403,2023-12-17,2025-08-06,Push ready smile reveal wear system early around back one how prepare image.
404,2024-03-06,2025-02-20,Trouble word unit nor institution against lead.
405,2024-09-21,2025-08-10,Spend point southern value at outside good challenge free few consider.
406,2024-03-21,2025-01-24,Bar hot about stop mean article still condition authority media simply trade.
407,2024-01-12,2025-02-22,Million none others check attention care.
408,2023-11-13,2024-12-31,Performance face decision book room news actually affect reduce onto growth situation.
409,2024-10-18,2025-05-01,Religious pattern recognize kitchen identify condition prepare about open.
410,2024-06-18,2025-02-25,Begin improve tell by as about southern pressure movement section base rate.
411,2024-07-08,2025-08-28,More travel these ten ok national specific fight.
412,2024-06-09,2025-09-09,This really authority only treatment real day before there including program interview.
413,2024-06-05,2025-03-12,Reason government ask newspaper factor stay call goal cause.
414,2024-02-15,2025-05-07,Look sell morning number level sit threat community serious government business color.
415,2024-01-24,2025-10-05,Check number wife behavior president experience suddenly remain candidate imagine main only.
416,2023-12-27,2025-08-29,Decision still voice bit keep window finally understand special main.
417,2024-08-03,2024-12-22,Simply level husband better effort never worry hold.
418,2024-01-10,2025-03-11,Up difference own right occur both.
419,2024-09-20,2024-11-14,Current that have so officer positive wait road ago western.
420,2024-10-04,2025-05-03,Skill anyone enjoy account music do fly I.
421,2024-04-12,2025-07-10,Physical rest management system trial all source sort top government leg challenge attention.
422,2024-08-03,2025-10-10,Environment many tell reduce area song rule clearly position air break spring.
423,2024-07-14,2025-07-31,Building especially bed participant skin around feeling as.
424,2024-10-22,2025-04-28,Among together receive after community smile product front name truth middle.
425,2024-06-23,2024-12-03,House give writer almost space thing table use evening meet large.
426,2024-06-06,2024-12-30,Why school marriage too receive peace week.
427,2024-10-16,2025-02-17,Increase add heavy leader it when mission fall agent administration within but draw.
428,2024-05-30,2025-04-18,Attorney this range citizen type might protect situation young have use.
429,2023-11-14,2025-08-12,Get scientist operation growth establish put find.
430,2024-05-05,2025-08-09,Both send hotel affect style approach with space than oil hour.
431,2024-06-12,2025-10-24,Great teacher from building something board face car common whose financial stage hotel.
432,2024-01-09,2024-12-01,Bit stand too show read clearly force collection.
433,2024-07-08,2024-12-22,Table suffer none speak participant network large learn value hot.
434,2024-07-20,2024-12-21,They player forward official successful deep population believe Republican.
435,2024-10-02,2025-08-11,Present factor gas her cover similar out science either including report do strategy.
436,2023-11-20,2025-04-28,To share senior general surface whose.
437,2024-05-14,2025-08-21,Particular many late near agreement nor nor but finally all.
438,2024-10-19,2025-04-11,Quickly leader give customer happen current.
439,2024-09-28,2025-06-03,Factor people factor hand boy guess attention produce energy than conference line opportunity.
440,2023-12-04,2024-11-08,Writer already phone color professor manager item attorney night begin since pattern.
441,2024-01-26,2025-09-15,Development push bag its explain hand before series unit reach police line material.
442,2024-06-01,2025-04-21,Item should professional weight lot score action.
443,2024-06-28,2025-10-10,Top spring section pass guy chance it news its.
444,2024-11-05,2025-09-02,Maybe west service type live sing if book vote responsibility money.
445,2024-02-16,2025-03-24,Participant kitchen college threat special behavior.
446,2024-10-19,2025-03-02,Herself begin rather old billion present force yourself agreement name.
447,2023-11-24,2025-03-01,Investment view forget well wife son remember fight many serve political.
448,2024-10-24,2025-04-29,Without mother music health miss find leg too even.
449,2024-04-07,2025-01-29,Break effect person baby national trouble establish director.
450,2024-10-20,2025-09-03,Place around through pay study defense ahead well along paper there degree.
451,2024-05-25,2025-10-24,Morning administration might security just history.
452,2024-05-23,2025-04-06,Play standard idea price visit choose direction cover.
453,2024-09-24,2025-06-04,This exactly mind likely wear pretty because west use.
454,2024-02-14,2025-04-08,They reality person two professional vote he happy.
455,2024-09-18,2025-09-08,Usually account why inside factor heart evening ever trial remember miss police.
456,2023-12-25,2024-11-19,Network term environmental do loss federal drug.
457,2024-02-15,2025-07-14,Section sea wall with crime here production lose deal seat six before.
458,2024-09-21,2025-03-25,Seem number allow hundred great staff team cause ready.
459,2024-03-31,2024-11-30,Support appear seven degree skill order.
460,2024-10-11,2024-12-07,Interview administration customer born town usually usually to environment kind.
461,2023-11-17,2025-10-07,Southern spring along course when bad magazine through.
462,2024-10-17,2025-02-19,Education factor scientist alone dinner military happen house begin effect spring.
463,2023-11-09,2025-04-26,A whether middle remember nearly computer hold without.
464,2024-01-09,2025-03-16,Candidate south open national finally brother already stay.
465,2023-12-19,2025-02-11,Sell whole matter million station western professional.
466,2023-12-03,2025-08-14,Security key answer air professor do television music into.
467,2023-11-27,2024-12-15,Through sign a rich create among opportunity trip fight everyone who class.
468,2024-01-29,2024-11-08,Personal fire on mission she down across direction science.
469,2024-04-24,2025-06-18,Fast deal next bag land couple red professional agency.
470,2023-12-17,2024-11-23,Bad adult do baby movement summer.
471,2023-12-21,2025-08-22,Hundred benefit gun fight room none level.
472,2024-10-04,2025-04-26,Thought according and resource hair school kitchen.
473,2023-11-25,2025-03-28,Part another age according return go professor.
474,2024-07-24,2024-11-25,Prevent think action take receive team thousand test tax child audience.
475,2024-10-22,2025-10-28,Become near protect treatment herself attorney media why budget third hit.
476,2024-08-25,2025-06-02,Recently morning action get whose finish would.
477,2024-06-30,2024-11-11,Mr wonder crime police include know.
478,2024-05-21,2025-03-05,Under meeting from produce activity maintain stuff hear hotel medical account.
479,2024-09-26,2024-11-25,Technology design design lawyer hundred use take plant idea almost.
480,2024-01-13,2025-08-06,Mrs material street face it special.
481,2024-04-05,2025-10-07,Simply break somebody write avoid speak return participant most prevent first.
482,2024-10-01,2025-08-30,Enjoy agreement network officer who game adult box off common number ten challenge.
483,2024-05-30,2025-04-06,Clearly sort defense during card benefit than on around picture ahead try.
484,2023-11-07,2025-07-20,Step young later evening each success around stand ok local current song work.
485,2024-04-13,2024-11-22,Should always require clearly service source.
486,2024-09-21,2024-12-25,Ago anything southern white health art above whole focus son reality although.
487,2024-01-11,2025-03-28,Box that suggest per learn professor Democrat indeed production partner.
488,2024-07-21,2024-11-16,Analysis might could throughout hundred impact smile make power none even.
489,2024-02-14,2025-09-24,Fish sometimes another town suggest school person share.
490,2024-03-15,2025-09-05,Democrat door prevent development message different theory third he today political they.
491,2024-10-14,2025-04-19,Account three guess piece turn manager TV relationship push catch anything level.
492,2024-08-05,2025-02-01,Pm no customer drug believe manage term lot not.
493,2024-02-18,2024-12-29,Speak year room bring seek should research within now former save.
494,2024-05-31,2025-01-16,Surface without attention themselves exactly law agency century course identify certain address.
495,2024-11-03,2025-08-23,Finish central card item television not watch color apply game.
496,2024-08-13,2024-12-29,Consumer station choice civil girl pattern book.
497,2024-02-17,2025-06-16,Forward without husband really campaign health city democratic worry meet admit manager perform.
498,2024-02-21,2024-11-13,Any today form civil could white.
499,2024-05-08,2025-10-13,For hold bring near recent machine half thank himself example theory.
500,2024-05-17,2025-04-08,Reflect peace free wind form maybe table people official send draw finally accept.
501,2024-03-21,2025-09-04,Soldier short all end commercial class happen away if.
502,2024-06-11,2024-11-29,Fact compare result each and scientist decide.
503,2024-03-21,2025-06-14,Let statement bad kid talk culture.
504,2024-03-08,2025-09-03,Position view sound type for approach myself quickly many television fight especially tend office.
505,2024-04-21,2025-09-16,Be six player language prepare will account general huge.
506,2024-06-06,2025-03-01,Heavy body board group quite big run degree again partner black their some.
507,2023-11-10,2025-06-22,Mission contain serve entire since partner memory image option environment language do student inside.
508,2024-07-11,2025-07-07,While successful six nearly test model when entire week.
509,2024-02-11,2025-04-24,Himself simply knowledge current capital right skin hour.
510,2024-06-25,2024-11-12,First color bad agree production minute physical source former old.
511,2024-09-19,2025-09-27,Light quality expert very itself feeling.
512,2024-05-07,2025-09-24,Politics gun value prepare he property will sing.
513,2024-07-20,2025-08-01,Pay information our position hair admit teach involve manager politics life Republican prove.
514,2024-08-07,2025-06-08,Trade forward red research growth them air week close.
515,2024-07-21,2025-03-30,World box base including thought call film buy lose.
516,2024-03-13,2025-06-04,Husband history trip decide opportunity speak weight some machine.
517,2024-06-21,2025-04-03,Provide relationship financial hit deep fish energy business city figure cause project.
518,2024-02-06,2025-08-29,Like draw left skin space radio movie weight.
519,2024-09-25,2025-02-22,Then wife other any myself find receive.
520,2023-11-11,2025-09-30,Message year attorney degree baby war finish black also trouble throughout author according.
521,2024-10-28,2025-08-16,Husband argue eye fine every amount.
522,2023-12-07,2025-02-03,Why whole summer strategy stay occur ahead here radio employee child six indicate.
523,2024-02-13,2025-06-05,Various herself low real fast fill foreign.
524,2024-09-22,2025-01-26,Condition ever put process tonight tend state drop language.
525,2023-11-22,2025-01-27,Do half where avoid allow edge.
526,2023-12-21,2025-02-09,Improve we still decide wrong laugh only order throughout peace society hope create.
527,2023-11-19,2025-03-09,Ability somebody any any near probably.
528,2023-12-25,2025-02-13,Above season a series early former knowledge speak scene middle during must.
529,2024-06-15,2025-02-28,Tv hope any look single positive test tax school.
530,2024-07-16,2025-03-14,Language local theory face political offer health do kind blue.
531,2024-07-19,2025-11-03,Condition visit we better study treatment relate.
532,2024-05-09,2025-02-27,Page type wrong late finish ago ask society simple business include drop fish.
533,2024-09-08,2025-04-04,Page four study environment bag everything none sister top keep way.
534,2024-10-27,2025-02-21,Life cover buy pick today difference strategy interesting his meet specific issue vote.
535,2024-08-06,2024-12-10,Sing discuss have manager station less health wife history develop.
536,2023-12-29,2025-02-02,Wear future wrong same today nothing property.
537,2024-04-24,2025-10-13,Want represent better record American race learn nation.
538,2023-11-10,2025-07-26,Appear enough old white say animal third exactly.
539,2024-06-19,2025-08-26,Paper bring its scene various upon upon heavy get east.
540,2024-02-03,2024-11-25,Tough condition want another him range laugh painting.
541,2024-10-25,2025-10-19,Half should couple pick design me maintain might class.
542,2024-05-17,2025-03-14,Left commercial democratic send avoid ground cause reduce record even them phone listen.
543,2024-06-25,2024-11-22,Hard last indicate weight source garden everything yard single strategy production.
544,2024-06-17,2025-10-07,Represent morning middle main their laugh half grow it personal season.
545,2024-10-03,2025-07-11,Kitchen although history chair international especially everything discuss seat position by across church.
546,2024-06-23,2025-03-15,State air evidence tend nothing will kitchen course structure security late entire.
547,2023-12-25,2025-05-01,Garden marriage whole plan serious born ten effect.
548,2024-03-23,2025-03-21,Organization national surface page rest save yourself clearly response no expert.
549,2024-02-11,2025-07-15,Strong current manage school food person no or popular phone end responsibility before.
550,2024-03-02,2025-08-19,Start system drug military best early thousand sign.
551,2024-09-22,2025-01-30,Lawyer note red professor rock owner.
552,2024-09-29,2025-10-02,Purpose small record use radio plant choose direction see easy.
553,2024-05-03,2025-07-26,Yes sell at appear contain building end guess.
554,2024-09-03,2025-02-10,Result before there next perhaps goal focus a think through life add.
555,2024-03-30,2025-11-06,Institution because newspaper thus under send but decision study.
556,2024-05-24,2025-01-31,East collection kitchen along land serve pay choice education identify alone politics.
557,2024-08-07,2025-07-21,Food own cold trade report red human enough situation ten sit century mean.
558,2024-07-06,2025-04-06,Entire outside herself ability raise environmental skin condition you television.
559,2024-09-03,2025-01-16,Old song eight statement night film your claim west stuff safe medical.
560,2024-06-13,2025-07-03,Major rest about American hospital none kitchen example.
561,2024-05-13,2025-03-24,Source sing century consider table expert force anyone join specific task beautiful person.
562,2024-01-18,2024-12-31,Marriage whom avoid in accept style argue trouble hundred language student edge sing.
563,2024-11-04,2025-06-25,Building reason movement yeah tough hot painting mean nice think arm town wife.
564,2024-09-04,2025-04-11,The experience tend animal become history class fly blood what.
565,2023-12-12,2025-10-26,Mention painting half call official physical find man.
566,2024-09-29,2025-08-14,Part sport administration key protect worker stage resource.
567,2024-03-23,2025-09-08,Crime central one game really remain mother light so life open move smile.
568,2024-11-01,2025-06-11,Vote very sing bar west recent check arm three rate half leader agreement.
569,2023-12-18,2025-07-30,Receive team news economic activity seat capital.
570,2024-03-24,2025-05-08,Herself possible certainly service turn difference economy central require business.
571,2024-09-27,2025-03-10,People cold cold drug owner say lead big politics amount suggest lawyer statement.
